{
  "$schema": "../message-execution.schema.json",
  "schemaVersion": 1,
  "operationId": "20260916053422-message-posted-in-acoaabkwz3mbos8hdeimfpklc9my8mzmukfwsyq",
  "action": "message_posted",
  "recordedAt": "2026-09-16T05:34:22Z",
  "executionSurface": "user_initiated_signed_in_linkedin_ui",
  "initiatedBy": "user",
  "githubIssueNumber": 36,
  "userConfirmation": {
    "obtained": true,
    "confirmedAt": "2026-09-16T05:34:22Z",
    "scope": "User approved D1 exactly as shown."
  },
  "result": {
    "status": "message_posted",
    "recipientProfileUrl": "https://www.linkedin.com/in/ACoAABKWz3MBoS8HDeIMfPkLC9mY8MzMukFWsyQ",
    "messageTextSha256": "0d4d927ecf2cc13015f9099b242f3f3d04844eb8c6b69f823295e1a53490eb6f",
    "verifiedAt": "2026-09-16T05:34:22Z",
    "verification": "Verified exact outgoing message under Aditya Singh at 11:02 AM; sending state cleared and composer empty."
  },
  "secretsStored": false,
  "githubActionsPerformedLinkedInAction": false
}
