{
  "$schema": "../message-execution.schema.json",
  "schemaVersion": 1,
  "operationId": "20260828074106-message-posted-in-garima-kakkar-54456b60",
  "action": "message_posted",
  "recordedAt": "2026-08-28T07:41:06Z",
  "executionSurface": "user_initiated_signed_in_linkedin_ui",
  "initiatedBy": "user",
  "githubIssueNumber": 36,
  "userConfirmation": {
    "obtained": true,
    "confirmedAt": "2026-08-28T07:41:06Z",
    "scope": "Approve all three exactly as written"
  },
  "result": {
    "status": "message_posted",
    "recipientProfileUrl": "https://www.linkedin.com/in/garima-kakkar-54456b60/",
    "messageTextSha256": "b53d9c084ed47819b84af8ae1b6692763bbdef4d5c53da1e431bc6add4c505bf",
    "verifiedAt": "2026-08-28T07:41:06Z",
    "verification": "LinkedIn rendered the exact approved message in the Garima Kakkar conversation under Aditya Singh at 1:09 PM and the composer cleared after sending"
  },
  "secretsStored": false,
  "githubActionsPerformedLinkedInAction": false
}
