{
  "$schema": "../message-execution.schema.json",
  "schemaVersion": 1,
  "operationId": "20260831065746-message-posted-matthew-arredondo",
  "action": "message_posted",
  "recordedAt": "2026-08-31T06:57:46Z",
  "executionSurface": "user_initiated_signed_in_linkedin_ui",
  "initiatedBy": "user",
  "githubIssueNumber": 36,
  "userConfirmation": {
    "obtained": true,
    "confirmedAt": "2026-08-31T06:50:00Z",
    "scope": "Approved D1 and D2, L1, L2, L4, L16, L17, M1 and M2 exactly as written and before that go ahead and check with notifications."
  },
  "result": {
    "status": "message_posted",
    "recipientProfileUrl": "https://www.linkedin.com/in/ACoAAA9-hNoBQFF9OaCIyLpEyfv0jm7aErs8cdc",
    "messageTextSha256": "3ca4b6aeabdd5a4e6d73b671b225ebf8d279018e571dfedeac953e45f930dbfa",
    "verifiedAt": "2026-08-31T06:57:46Z",
    "verification": "The signed-in LinkedIn conversation with Matthew Arredondo rendered the exact approved message under Aditya Singh at 12:19 PM."
  },
  "secretsStored": false,
  "githubActionsPerformedLinkedInAction": false
}
