{
  "$schema": "../message-execution.schema.json",
  "schemaVersion": 1,
  "operationId": "20260912142230-message-posted-in-kumargaurav7",
  "action": "message_posted",
  "recordedAt": "2026-09-12T14:22:30Z",
  "executionSurface": "user_initiated_signed_in_linkedin_ui",
  "initiatedBy": "user",
  "githubIssueNumber": 36,
  "userConfirmation": {
    "obtained": true,
    "confirmedAt": "2026-09-12T14:22:30Z",
    "scope": "User approved N1, N2 and D1-D3 exactly as written, then requested relevant tags. This receipt covers only the exact D3 private reply in the existing one-to-one conversation; no attachments, links or additional recipients."
  },
  "result": {
    "status": "message_posted",
    "recipientProfileUrl": "https://www.linkedin.com/in/kumargaurav7/",
    "messageTextSha256": "775f4d53ae4d5555c36a9f91dc69cfba4a4547df0c7203fbb1f0d1659d41d9e0",
    "verifiedAt": "2026-09-12T14:22:30Z",
    "verification": "Immediately rechecked the recipient conversation and absence of duplicates. Exact approved message rendered under Aditya Singh at 7:50 PM IST on September 12, 2026. Refreshed inbox, reopened the same recipient and verified exact text persisted. Private wording and conversation URLs are not retained."
  },
  "secretsStored": false,
  "githubActionsPerformedLinkedInAction": false
}
