{
  "$schema": "../message-execution.schema.json",
  "schemaVersion": 1,
  "operationId": "20260831065747-message-posted-vijayakumar-unnithan",
  "action": "message_posted",
  "recordedAt": "2026-08-31T06:57:47Z",
  "executionSurface": "user_initiated_signed_in_linkedin_ui",
  "initiatedBy": "user",
  "githubIssueNumber": 36,
  "userConfirmation": {
    "obtained": true,
    "confirmedAt": "2026-08-31T06:50:00Z",
    "scope": "Approved D1 and D2, L1, L2, L4, L16, L17, M1 and M2 exactly as written and before that go ahead and check with notifications."
  },
  "result": {
    "status": "message_posted",
    "recipientProfileUrl": "https://www.linkedin.com/in/ACoAAAAXJaMB3Ksy52vE46ypekUz-7YAUJAvJ38",
    "messageTextSha256": "2186025a2f073be49e3550e58279a55c286c4cae1813dae70179378445fdb113",
    "verifiedAt": "2026-08-31T06:57:47Z",
    "verification": "The signed-in LinkedIn conversation with Vijayakumar Parameswaran Unnithan PhD rendered the exact approved message under Aditya Singh at 12:20 PM."
  },
  "secretsStored": false,
  "githubActionsPerformedLinkedInAction": false
}
