{
  "$schema": "../message-execution.schema.json",
  "schemaVersion": 1,
  "operationId": "20260829051052-message-posted-in-matthew-arredondo-aa208173",
  "action": "message_posted",
  "recordedAt": "2026-08-29T05:10:52Z",
  "executionSurface": "user_initiated_signed_in_linkedin_ui",
  "initiatedBy": "user",
  "githubIssueNumber": 36,
  "userConfirmation": {
    "obtained": true,
    "confirmedAt": "2026-08-29T05:10:52Z",
    "scope": "Approve D1, D2 and D3 exactly as written"
  },
  "result": {
    "status": "message_posted",
    "recipientProfileUrl": "https://www.linkedin.com/in/matthew-arredondo-aa208173/",
    "messageTextSha256": "644924f4aa03f3a1e584520c7ec66e7df828608ced5eab9ffa0bbaaaf0a669c6",
    "verifiedAt": "2026-08-29T05:10:52Z",
    "verification": "LinkedIn rendered the exact approved message under Aditya Singh in the Matthew Arredondo conversation at 10:40 AM IST; the composer cleared after sending."
  },
  "secretsStored": false,
  "githubActionsPerformedLinkedInAction": false
}
