{
  "$schema": "../message-execution.schema.json",
  "schemaVersion": 1,
  "operationId": "20260829073432-message-posted-in-jyoti-kr-aroraa-6a9a5235",
  "action": "message_posted",
  "recordedAt": "2026-08-29T07:34:32Z",
  "executionSurface": "user_initiated_signed_in_linkedin_ui",
  "initiatedBy": "user",
  "githubIssueNumber": 36,
  "userConfirmation": {
    "obtained": true,
    "confirmedAt": "2026-08-29T07:34:32Z",
    "scope": "Approved P1, P2, P3, P4 and P5 exactly as listed."
  },
  "result": {
    "status": "message_posted",
    "recipientProfileUrl": "https://www.linkedin.com/in/jyoti-kr-aroraa%F0%9F%92%8E-6a9a5235/",
    "messageTextSha256": "6e29f4d987722f04727454295c8e43d83a7ee66424274eda4346ea191ef9efff",
    "verifiedAt": "2026-08-29T07:34:32Z",
    "verification": "LinkedIn displayed ‘Message sent successfully,’ rendered the exact approved message under Aditya Singh in the Jyoti Kr Aroraa conversation at 1:03 PM IST and cleared the composer."
  },
  "secretsStored": false,
  "githubActionsPerformedLinkedInAction": false
}
