{
  "$schema": "../message-execution.schema.json",
  "schemaVersion": 1,
  "operationId": "20260829073432-message-posted-in-matthew-arredondo-aa208173",
  "action": "message_posted",
  "recordedAt": "2026-08-29T07:34:32Z",
  "executionSurface": "user_initiated_signed_in_linkedin_ui",
  "initiatedBy": "user",
  "githubIssueNumber": 36,
  "userConfirmation": {
    "obtained": true,
    "confirmedAt": "2026-08-29T07:34:32Z",
    "scope": "Approved P1, P2, P3, P4 and P5 exactly as listed."
  },
  "result": {
    "status": "message_posted",
    "recipientProfileUrl": "https://www.linkedin.com/in/matthew-arredondo-aa208173/",
    "messageTextSha256": "8fdefb001e1c7ab537524428ff5a75f3d470c509a01e55cb03fb1081d8e31c69",
    "verifiedAt": "2026-08-29T07:34:32Z",
    "verification": "LinkedIn displayed ‘Message sent successfully,’ rendered the exact approved message under Aditya Singh in the Matthew Arredondo conversation at 1:02 PM IST and cleared the composer."
  },
  "secretsStored": false,
  "githubActionsPerformedLinkedInAction": false
}
