{
  "$schema": "../message-execution.schema.json",
  "schemaVersion": 1,
  "operationId": "20260829113042-message-posted-in-matthew-arredondo-aa208173",
  "action": "message_posted",
  "recordedAt": "2026-08-29T11:30:42Z",
  "executionSurface": "user_initiated_signed_in_linkedin_ui",
  "initiatedBy": "user",
  "githubIssueNumber": 36,
  "userConfirmation": {
    "obtained": true,
    "confirmedAt": "2026-08-29T11:30:42Z",
    "scope": "Approved H1, H2 and H3 exactly as written."
  },
  "result": {
    "status": "message_posted",
    "recipientProfileUrl": "https://www.linkedin.com/in/matthew-arredondo-aa208173/",
    "messageTextSha256": "6f82342bfe2ab329c664284c2f5af8555c408d4c63b51cff28890abf5ec9dca6",
    "verifiedAt": "2026-08-29T11:30:42Z",
    "verification": "LinkedIn rendered the exact approved message under Aditya Singh in the Matthew Arredondo conversation at 4:59 PM IST and cleared the composer after sending."
  },
  "secretsStored": false,
  "githubActionsPerformedLinkedInAction": false
}
